{
  "assets": {},
  "createdWith": {
    "appVersion": "1.0.0"
  },
  "entryMode": "config",
  "format": "slicewise-preset",
  "formatVersion": 1,
  "id": "6e1c5089-468c-45d2-8ff1-6a1c59482100",
  "metadata": {
    "author": "Slicewise",
    "createdAt": "2026-09-09T00:00:00.000Z",
    "description": "A clean ring torus with evenly spaced contours.",
    "license": "MIT",
    "name": "Torus line study",
    "tags": ["contours", "torus"],
    "updatedAt": "2026-09-09T00:00:00.000Z"
  },
  "sections": {
    "animation": {
      "data": {
        "project": null
      },
      "requiredFeatures": [],
      "version": 1
    },
    "authoring": {
      "data": {
        "randomLocks": []
      },
      "requiredFeatures": [],
      "version": 1
    },
    "drawing": {
      "data": {
        "paperOrientation": "portrait",
        "paperPreset": "custom",
        "settings": {
          "axis": "up",
          "az": 35,
          "backgroundColor": "#ffffff",
          "bg": true,
          "blockGlitch": false,
          "blockGlitchClearDestination": false,
          "blockGlitchCount": 3,
          "blockGlitchDirection": "horizontal",
          "blockGlitchDisplacement": 8,
          "blockGlitchHeight": 6,
          "blockGlitchSeed": 1,
          "blockGlitchWidth": 18,
          "blueprint": false,
          "blueprintStyle": "blue",
          "chroma": false,
          "chromaAmount": 1.5,
          "clipToArtboard": true,
          "color": "#15181a",
          "contourWeave": false,
          "curvatureContrast": 100,
          "curvatureIncludeZero": true,
          "curvatureMethod": "gaussian",
          "curvatureRange": 98,
          "curvatureSmoothing": 2,
          "cutAz": 0,
          "cutEl": 90,
          "cylinderAzimuth": 0,
          "cylinderElevation": 90,
          "divergence": 0,
          "easeCenter": 50,
          "easeCycles": 1,
          "easeStrength": 100,
          "el": 24,
          "explodeAmount": 0,
          "gapEase": "linear",
          "geodesicMode": "single",
          "geodesicSeedAzimuth": 0,
          "geodesicSeedBAzimuth": 0,
          "geodesicSeedBElevation": -90,
          "geodesicSeedElevation": 90,
          "gradientColors": 6,
          "gradientEnabled": false,
          "gradientStops": [
            {
              "color": "#ef4444",
              "position": 0
            },
            {
              "color": "#f59e0b",
              "position": 0.2
            },
            {
              "color": "#84cc16",
              "position": 0.4
            },
            {
              "color": "#06b6d4",
              "position": 0.6
            },
            {
              "color": "#3b82f6",
              "position": 0.8
            },
            {
              "color": "#8b5cf6",
              "position": 1
            }
          ],
          "halftone": false,
          "halftoneContrast": 75,
          "halftoneCycles": 2,
          "halftoneSize": 2.4,
          "hide": true,
          "humanizer": false,
          "humanizerAmount": 30,
          "inversionCenterX": 0,
          "inversionCenterY": 0,
          "inversionRadius": 50,
          "inversionStrength": 100,
          "kaleidoscope": false,
          "kaleidoscopeRotation": 0,
          "kaleidoscopeSegments": 6,
          "lensDistortion": 0,
          "lensFocalLength": 50,
          "lensPerspective": 0,
          "lensWarpExponent": 0,
          "lineIndexColorEnabled": false,
          "lineIndexColors": [
            {
              "color": "#ef4444",
              "index": 1,
              "reverse": false,
              "series": "single"
            }
          ],
          "lineWeightAmount": 100,
          "lineWeightInterval": 5,
          "lineWeightMode": "uniform",
          "lines": 40,
          "mapBuildings": 12,
          "mapElevations": 8,
          "mapIndexEvery": 5,
          "mapLabels": 6,
          "mapLandmarks": 4,
          "mapRivers": 1,
          "mapRoads": 2,
          "mapSeed": 1,
          "mapSymbolScale": 100,
          "mapTextScale": 100,
          "mapWoodland": 5,
          "margin": 14,
          "maskEnabled": false,
          "maskLfo1Amplitude": 0,
          "maskLfo1Cycles": 3,
          "maskLfo1Phase": 0,
          "maskLfo1Waveform": 0,
          "maskLfo2Amplitude": 0,
          "maskLfo2Cycles": 5,
          "maskLfo2Phase": 90,
          "maskLfo2Waveform": 0,
          "maskOffsetX": 0,
          "maskOffsetY": 0,
          "maskOutline": false,
          "maskRoundness": 100,
          "maskScaleX": 100,
          "maskScaleY": 100,
          "misregistration": false,
          "misregistrationColor1": "#00a7e1",
          "misregistrationColor2": "#ec008c",
          "misregistrationColor3": "#ffd400",
          "misregistrationCopies": 2,
          "misregistrationOffset": 2,
          "misregistrationRotation": 0.5,
          "misregistrationScope": "contours",
          "mobiusDirection": 0,
          "mobiusDisplacement": 0,
          "mobiusRotation": 0,
          "mobiusStrength": 100,
          "morphEnabled": false,
          "morphSecondEnabled": false,
          "morphSteps": 4,
          "morphStepsY": 4,
          "morphTargets": {},
          "morphTargets2": {},
          "objectBend": true,
          "objectBendAngle": 0,
          "objectBendAxis": "z",
          "objectBendDirection": 0,
          "objectBulge": true,
          "objectBulgeAmount": 0,
          "objectBulgeAxis": "z",
          "objectBulgeCenter": 50,
          "objectBulgeWidth": 100,
          "objectEnabled": false,
          "objectNoise": true,
          "objectNoiseAmount": 0,
          "objectNoiseSeed": 1,
          "objectNoiseSize": 100,
          "objectRipple": true,
          "objectRippleAmount": 0,
          "objectRippleAxis": "z",
          "objectRippleDirection": 0,
          "objectRipplePhase": 0,
          "objectRippleWavelength": 100,
          "objectRotation": true,
          "objectRotationX": 0,
          "objectRotationY": 0,
          "objectRotationZ": 0,
          "objectScaleX": 100,
          "objectScaleY": 100,
          "objectScaleZ": 100,
          "objectShear": true,
          "objectShearAmount": 0,
          "objectShearAxis": "z",
          "objectShearDirection": 0,
          "objectStretch": true,
          "objectTaper": true,
          "objectTaperAmount": 0,
          "objectTaperAxis": "z",
          "objectTwist": true,
          "objectTwistAngle": 0,
          "objectTwistAxis": "z",
          "panX": 0,
          "panY": 0,
          "ph": 210,
          "projectionWarpMode": "none",
          "pw": 210,
          "quality": 7,
          "roll": 0,
          "sampleAndHold": false,
          "sampleAndHoldAxis": "y",
          "sampleAndHoldLength": 4,
          "sampleAndHoldMix": 100,
          "sampleAndHoldSpacing": 2,
          "scanBandGlitch": false,
          "scanBandGlitchCount": 12,
          "scanBandGlitchDensity": 50,
          "scanBandGlitchDisplacement": 6,
          "scanBandGlitchOrientation": "horizontal",
          "scanBandGlitchSeed": 2,
          "scanBandGlitchThickness": 55,
          "sil": true,
          "sliceLfo": false,
          "sliceLfoAmplitude": 75,
          "sliceLfoAngle": 0,
          "sliceLfoCycles": 2,
          "sliceLfoModulation": false,
          "sliceLfoModulationCycles": 1,
          "sliceLfoModulationDepth": 50,
          "sliceLfoModulationMode": "amplitude",
          "sliceLfoModulationPhase": 0,
          "sliceLfoPhase": 0,
          "sliceLfoWaveform": "sine",
          "sliceRayAmount": 24,
          "sliceRayFade": 50,
          "sliceRayLength": 12,
          "sliceRayVariation": 35,
          "sliceRays": false,
          "sphericalStrength": 100,
          "spiral": false,
          "staggeredSlices": false,
          "staggeredSlicesCount": 12,
          "staggeredSlicesDisplacement": 10,
          "staggeredSlicesExtent": 70,
          "staggeredSlicesOrientation": "horizontal",
          "staggeredSlicesPattern": "ramp",
          "staggeredSlicesSeed": 3,
          "svgSlicePaths": [],
          "svgSliceRotation": 0,
          "svgSliceScale": 100,
          "svgSliceX": 0,
          "svgSliceY": 0,
          "sw": 0.35,
          "tileShuffle": false,
          "tileShuffleAffected": 50,
          "tileShuffleColumns": 4,
          "tileShuffleExtent": 80,
          "tileShuffleRows": 4,
          "tileShuffleSeed": 4,
          "topographicMap": false,
          "vectorZoom1CenterX": 45,
          "vectorZoom1CenterY": 45,
          "vectorZoom1Color": "#15181a",
          "vectorZoom1Corner": "top-right",
          "vectorZoom1Enabled": false,
          "vectorZoom1Height": 20,
          "vectorZoom1Margin": 14,
          "vectorZoom1Shape": "rectangle",
          "vectorZoom1Size": 30,
          "vectorZoom1Width": 20,
          "vectorZoom2CenterX": 55,
          "vectorZoom2CenterY": 45,
          "vectorZoom2Color": "#15181a",
          "vectorZoom2Corner": "top-left",
          "vectorZoom2Enabled": false,
          "vectorZoom2Height": 20,
          "vectorZoom2Margin": 14,
          "vectorZoom2Shape": "rectangle",
          "vectorZoom2Size": 30,
          "vectorZoom2Width": 20,
          "vectorZoom3CenterX": 45,
          "vectorZoom3CenterY": 55,
          "vectorZoom3Color": "#15181a",
          "vectorZoom3Corner": "bottom-right",
          "vectorZoom3Enabled": false,
          "vectorZoom3Height": 20,
          "vectorZoom3Margin": 14,
          "vectorZoom3Shape": "circle",
          "vectorZoom3Size": 30,
          "vectorZoom3Width": 20,
          "vectorZoom4CenterX": 55,
          "vectorZoom4CenterY": 55,
          "vectorZoom4Color": "#15181a",
          "vectorZoom4Corner": "bottom-left",
          "vectorZoom4Enabled": false,
          "vectorZoom4Height": 20,
          "vectorZoom4Margin": 14,
          "vectorZoom4Shape": "circle",
          "vectorZoom4Size": 30,